{
  "$ref": "#/definitions/ModelRegistry",
  "definitions": {
    "ModelRegistry": {
      "type": "object",
      "properties": {
        "$schema": {
          "type": "string"
        },
        "schemaVersion": {
          "type": "number",
          "const": 1
        },
        "updatedAt": {
          "type": "string",
          "format": "date-time",
          "pattern": "^(?:(?:\\d\\d[2468][048]|\\d\\d[13579][26]|\\d\\d0[48]|[02468][048]00|[13579][26]00)-02-29|\\d{4}-(?:(?:0[13578]|1[02])-(?:0[1-9]|[12]\\d|3[01])|(?:0[469]|11)-(?:0[1-9]|[12]\\d|30)|(?:02)-(?:0[1-9]|1\\d|2[0-8])))T(?:(?:[01]\\d|2[0-3]):[0-5]\\d:[0-5]\\d(?:\\.\\d+)?(?:Z|([+-](?:[01]\\d|2[0-3]):[0-5]\\d)))$"
        },
        "source": {
          "type": "string"
        },
        "providers": {
          "type": "object",
          "propertyNames": {
            "type": "string"
          },
          "additionalProperties": {
            "type": "object",
            "properties": {
              "tiers": {
                "type": "object",
                "properties": {
                  "flagship": {
                    "type": "string"
                  },
                  "performant": {
                    "type": "string"
                  },
                  "efficient": {
                    "type": "string"
                  }
                },
                "additionalProperties": false
              },
              "knownModels": {
                "type": "object",
                "propertyNames": {
                  "type": "string"
                },
                "additionalProperties": {
                  "type": "object",
                  "properties": {
                    "harnessProfile": {
                      "type": "string",
                      "const": "astra"
                    },
                    "apiId": {
                      "type": "string"
                    },
                    "release": {
                      "type": "string"
                    }
                  },
                  "required": [
                    "apiId",
                    "release"
                  ]
                }
              }
            },
            "required": [
              "tiers",
              "knownModels"
            ]
          }
        }
      },
      "required": [
        "schemaVersion",
        "updatedAt",
        "source",
        "providers"
      ]
    }
  },
  "$schema": "http://json-schema.org/draft-07/schema#"
}
