{
  "$schema": "./model-registry.schema.json",
  "schemaVersion": 1,
  "updatedAt": "2026-09-25T00:00:00.000Z",
  "source": "vibe-doctor-upstream",
  "providers": {
    "codex": {
      "tiers": {
        "flagship": "astra"
      },
      "knownModels": {
        "astra": {
          "apiId": "gpt-6-astra",
          "release": "unknown",
          "harnessProfile": "astra"
        }
      }
    },
    "anthropic": {
      "tiers": {
        "flagship": "opus",
        "performant": "sonnet",
        "efficient": "haiku"
      },
      "knownModels": {
        "opus": {
          "apiId": "claude-opus-5-5",
          "release": "2026-09",
          "harnessProfile": "astra"
        },
        "sonnet": {
          "apiId": "claude-sonnet-4-6",
          "release": "2026-04"
        },
        "haiku": {
          "apiId": "claude-haiku-4-5",
          "release": "2025-10"
        }
      }
    }
  }
}
